{
  "$schema": "../schemas/level.schema.json",
  "id": "ch03_03_the_bottleneck",
  "version": 1,
  "chapterId": 3,
  "indexInChapter": 3,
  "metadata": {
    "titleKey": "level_03_03_title",
    "author": "Aitor Diaz",
    "difficultyTier": "medium",
    "estimatedSolveTimeSeconds": 84,
    "parMoves": 11,
    "mechanics": [
      "bottleneck",
      "parity"
    ]
  },
  "grid": {
    "width": 7,
    "height": 7
  },
  "islands": [
    {
      "id": 1,
      "x": 2,
      "y": 5,
      "capacity": 2
    },
    {
      "id": 2,
      "x": 2,
      "y": 3,
      "capacity": 1
    },
    {
      "id": 3,
      "x": 5,
      "y": 5,
      "capacity": 2
    },
    {
      "id": 4,
      "x": 0,
      "y": 6,
      "capacity": 1
    },
    {
      "id": 5,
      "x": 3,
      "y": 2,
      "capacity": 4
    },
    {
      "id": 6,
      "x": 3,
      "y": 0,
      "capacity": 4
    },
    {
      "id": 7,
      "x": 0,
      "y": 2,
      "capacity": 3
    },
    {
      "id": 8,
      "x": 5,
      "y": 0,
      "capacity": 3
    }
  ],
  "tutorial": {
    "hasInteractiveTutorial": false,
    "hintTriggers": []
  },
  "verification": {
    "solutionHash": "ec5e1dcd5aecf050b8f30888628991b04a85319084e330e512852bdedac24a84",
    "uniquenessVerified": true,
    "deductionDepth": 2
  }
}